{
  "$schema": "https://json-schema.org/draft/2020-12/schema",
  "title": "character_profile",
  "type": "object",
  "additionalProperties": false,
  "required": [
    "name",
    "universe",
    "sin_envy",
    "sin_lust",
    "sin_greed",
    "sin_pride",
    "sin_sloth",
    "sin_wrath",
    "sin_gluttony",
    "age_mental",
    "age_physical",
    "stat_wealth",
    "stat_influence",
    "stat_intellect",
    "stat_mystic_power",
    "stat_phys_strength",
    "stat_social_status",
    "appearance_aura",
    "appearance_cool",
    "appearance_cute",
    "appearance_neat",
    "appearance_scary",
    "appearance_elegant",
    "appearance_overall",
    "appearance_charismatic",
    "appearance_sexual",
    "behavior_calm",
    "behavior_playful",
    "behavior_dominant",
    "behavior_secretive",
    "behavior_aggressive",
    "behavior_submissive",
    "character_humor",
    "character_empathy",
    "character_honesty",
    "character_justice",
    "character_loyalty",
    "character_sarcasm",
    "character_ambition",
    "character_cynicism",
    "character_optimism",
    "character_risk_taking",
    "character_self_control",
    "character_ideology_focus",
    "character_self_sacrifice",
    "character_manipulativeness",
    "character_violence_for_goal",
    "character_romantic_intensity",
    "character_emotional_stability",
    "personality_extraversion",
    "motivation_duty",
    "motivation_love",
    "motivation_greed",
    "motivation_power",
    "motivation_freedom",
    "motivation_justice",
    "motivation_survival",
    "motivation_knowledge",
    "politics_auth_axis",
    "politics_econ_axis",
    "profession_academic",
    "profession_business",
    "profession_criminal",
    "profession_military",
    "profession_political",
    "profession_religious",
    "profession_technical",
    "profession_adventurer",
    "flag_has_pet",
    "flag_karen_rude",
    "flag_overweight",
    "flag_2d_character",
    "flag_plays_victim",
    "flag_war_criminal"
  ],
  "properties": {
    "name": { "type": "string", "minLength": 1 },
    "universe": { "type": "string", "minLength": 1 },

    "age_physical": { "type": "integer", "minimum": -1, "maximum": 4 },
    "age_mental": { "type": "integer", "minimum": -1, "maximum": 4 },

    "stat_phys_strength": { "type": "integer", "minimum": -1, "maximum": 10 },
    "stat_intellect": { "type": "integer", "minimum": -1, "maximum": 10 },
    "stat_mystic_power": { "type": "integer", "minimum": -1, "maximum": 10 },
    "stat_wealth": { "type": "integer", "minimum": -1, "maximum": 10 },
    "stat_influence": { "type": "integer", "minimum": -1, "maximum": 10 },
    "stat_social_status": { "type": "integer", "minimum": -1, "maximum": 10 },

    "appearance_overall": { "type": "integer", "minimum": -1, "maximum": 10 },
    "appearance_aura": { "type": "integer", "minimum": -1, "maximum": 10 },
    "appearance_cool": { "type": "integer", "minimum": -1, "maximum": 10 },
    "appearance_cute": { "type": "integer", "minimum": -1, "maximum": 10 },
    "appearance_scary": { "type": "integer", "minimum": -1, "maximum": 10 },
    "appearance_elegant": { "type": "integer", "minimum": -1, "maximum": 10 },
    "appearance_neat": { "type": "integer", "minimum": -1, "maximum": 10 },
    "appearance_charismatic": { "type": "integer", "minimum": -1, "maximum": 10 },
    "appearance_sexual": { "type": "integer", "minimum": -1, "maximum": 10 },

    "behavior_aggressive": { "type": "integer", "minimum": -1, "maximum": 10 },
    "behavior_calm": { "type": "integer", "minimum": -1, "maximum": 10 },
    "behavior_dominant": { "type": "integer", "minimum": -1, "maximum": 10 },
    "behavior_submissive": { "type": "integer", "minimum": -1, "maximum": 10 },
    "behavior_playful": { "type": "integer", "minimum": -1, "maximum": 10 },
    "behavior_secretive": { "type": "integer", "minimum": -1, "maximum": 10 },

    "character_ambition": { "type": "integer", "minimum": -1, "maximum": 10 },
    "character_cynicism": { "type": "integer", "minimum": -1, "maximum": 10 },
    "character_optimism": { "type": "integer", "minimum": -1, "maximum": 10 },
    "character_empathy": { "type": "integer", "minimum": -1, "maximum": 10 },
    "character_honesty": { "type": "integer", "minimum": -1, "maximum": 10 },
    "character_justice": { "type": "integer", "minimum": -1, "maximum": 10 },
    "character_loyalty": { "type": "integer", "minimum": -1, "maximum": 10 },
    "character_sarcasm": { "type": "integer", "minimum": -1, "maximum": 10 },
    "character_humor": { "type": "integer", "minimum": -1, "maximum": 10 },
    "character_risk_taking": { "type": "integer", "minimum": -1, "maximum": 10 },
    "character_self_control": { "type": "integer", "minimum": -1, "maximum": 10 },
    "character_ideology_focus": { "type": "integer", "minimum": -1, "maximum": 10 },
    "character_self_sacrifice": { "type": "integer", "minimum": -1, "maximum": 10 },
    "character_manipulativeness": { "type": "integer", "minimum": -1, "maximum": 10 },
    "character_violence_for_goal": { "type": "integer", "minimum": -1, "maximum": 10 },
    "character_romantic_intensity": { "type": "integer", "minimum": -1, "maximum": 10 },
    "character_emotional_stability": { "type": "integer", "minimum": -1, "maximum": 10 },

    "personality_extraversion": { "type": "integer", "minimum": -1, "maximum": 10 },

    "motivation_power": { "type": "integer", "minimum": -1, "maximum": 10 },
    "motivation_greed": { "type": "integer", "minimum": -1, "maximum": 10 },
    "motivation_freedom": { "type": "integer", "minimum": -1, "maximum": 10 },
    "motivation_survival": { "type": "integer", "minimum": -1, "maximum": 10 },
    "motivation_duty": { "type": "integer", "minimum": -1, "maximum": 10 },
    "motivation_love": { "type": "integer", "minimum": -1, "maximum": 10 },
    "motivation_justice": { "type": "integer", "minimum": -1, "maximum": 10 },
    "motivation_knowledge": { "type": "integer", "minimum": -1, "maximum": 10 },

    "politics_auth_axis": { "type": "integer", "minimum": -1, "maximum": 10 },
    "politics_econ_axis": { "type": "integer", "minimum": -1, "maximum": 10 },

    "profession_academic": { "type": "integer", "minimum": -1, "maximum": 10 },
    "profession_business": { "type": "integer", "minimum": -1, "maximum": 10 },
    "profession_criminal": { "type": "integer", "minimum": -1, "maximum": 10 },
    "profession_military": { "type": "integer", "minimum": -1, "maximum": 10 },
    "profession_political": { "type": "integer", "minimum": -1, "maximum": 10 },
    "profession_religious": { "type": "integer", "minimum": -1, "maximum": 10 },
    "profession_technical": { "type": "integer", "minimum": -1, "maximum": 10 },
    "profession_adventurer": { "type": "integer", "minimum": -1, "maximum": 10 },

    "sin_wrath": { "type": "integer", "minimum": -1, "maximum": 10 },
    "sin_pride": { "type": "integer", "minimum": -1, "maximum": 10 },
    "sin_greed": { "type": "integer", "minimum": -1, "maximum": 10 },
    "sin_envy": { "type": "integer", "minimum": -1, "maximum": 10 },
    "sin_lust": { "type": "integer", "minimum": -1, "maximum": 10 },
    "sin_gluttony": { "type": "integer", "minimum": -1, "maximum": 10 },
    "sin_sloth": { "type": "integer", "minimum": -1, "maximum": 10 },

    "flag_has_pet": { "type": "integer", "enum": [-1, 0, 1] },
    "flag_karen_rude": { "type": "integer", "enum": [-1, 0, 1] },
    "flag_overweight": { "type": "integer", "enum": [-1, 0, 1] },
    "flag_2d_character": { "type": "integer", "enum": [-1, 0, 1] },
    "flag_plays_victim": { "type": "integer", "enum": [-1, 0, 1] },
    "flag_war_criminal": { "type": "integer", "enum": [-1, 0, 1] }
  }
}
