{
  "name":"Suzune Horikita",
  "universe":"Classroom of the Elite",
  "age_physical":1,
  "age_mental":1,
  "appearance_overall":7,
  "appearance_cute":3,
  "appearance_charismatic":5,
  "appearance_cool":8,
  "appearance_scary":2,
  "appearance_elegant":6,
  "appearance_sexual":2,
  "appearance_neat":9,
  "appearance_aura":7,
  "behavior_secretive":7,
  "behavior_playful":2,
  "behavior_aggressive":4,
  "behavior_calm":7,
  "behavior_dominant":6,
  "behavior_submissive":2,
  "personality_extraversion":3,
  "character_honesty":7,
  "character_empathy":4,
  "character_loyalty":6,
  "character_justice":6,
  "character_self_control":8,
  "character_ambition":8,
  "character_optimism":4,
  "character_cynicism":5,
  "character_manipulativeness":6,
  "character_risk_taking":5,
  "character_emotional_stability":7,
  "character_humor":2,
  "character_sarcasm":4,
  "character_romantic_intensity":2,
  "character_violence_for_goal":3,
  "character_ideology_focus":5,
  "character_self_sacrifice":5,
  "sin_pride":7,
  "sin_envy":4,
  "sin_wrath":3,
  "sin_greed":3,
  "sin_lust":1,
  "sin_sloth":2,
  "sin_gluttony":1,
  "profession_academic":8,
  "profession_technical":3,
  "profession_military":0,
  "profession_political":2,
  "profession_business":0,
  "profession_criminal":0,
  "profession_religious":0,
  "profession_adventurer":0,
  "politics_econ_axis":6,
  "politics_auth_axis":5,
  "motivation_power":7,
  "motivation_love":3,
  "motivation_duty":6,
  "motivation_freedom":5,
  "motivation_justice":6,
  "motivation_survival":6,
  "motivation_knowledge":7,
  "motivation_greed":2,
  "stat_phys_strength":3,
  "stat_intellect":9,
  "stat_mystic_power":-1,
  "stat_influence":4,
  "stat_wealth":2,
  "stat_social_status":3,
  "flag_overweight":0,
  "flag_plays_victim":0,
  "flag_karen_rude":0,
  "flag_2d_character":1,
  "flag_war_criminal":0,
  "flag_has_pet":0
}
